<?xml version="1.0" encoding="UTF-8"?>
<Books xmlns:xs="http://www.w3.org/2001/XMLSchema-instance"
       xs:noNamespaceSchemaLocation="book.xsd">
    <Book Category="">
        <Name>aaaaa</Name>
        <Author>a</Author>
        <Price>10.0</Price>
    </Book>
    <Book Category="">
        <Name>abcde</Name>
        <Author>a</Author>
        <Price>10.0</Price>
    </Book>
    <Book Category="">
        <Name>a12345</Name>
        <Author>a</Author>
        <Price>10.0</Price>
    </Book>
</Books>